Comments,Output
Christian was fabulous. We would highly recommend! Made our honeymoon experience. Everything on the menu is elevated but reasonably priced. The ambiance is everything. Can't wait to come back,Ambiance - Great||Menu - Elevated||Price - Reasonable||Service - fabulous
"As soon as we walked in it was very very warm but I figured because we were super close to the door when we walked in that's why... just wait.

We got the soup dumplings which were 4/5 because they were super super delicate but very flavorful.

Also got the duck skewers which were my favorite part of the night. 5/5

At this point I started sweating a little bit but figured I would cool down...

Entrees came and I got the lamb chops which were served in a bowl which made it hard to eat and the chops were on the chewy side so it was a 3/5.

My boyfriend got the sesame chicken which was very tasty 5/5.

By the time we started eating I wanted to leave so bad because no A/C was running. My boyfriend & I were excited to get dessert but by this time we wanted to leave because we felt sweaty & gross... also, the warm water didn't help at all...

This place was good but needs some improvement on the small things. I'm being picky because I've worked in restaurants & I have a degree in hospitality administration so there was lots of little things that could've made my experience better.","Food - Soup dumplings (delicate and flavorful), Duck skewers (favorite), Lamb Chops (hard to eat in a bowl and chewy), Sesame chicken (tasty)||Ambiance - Very warm"
Visited from Hawaii and was looking for a place with good food and music. 1618 did NOT disappoint. Food and service was amazing! As well as the live performance. Jackie was our server for the night and did such an amazing job! She was very attentive with such a positive attitude. The GM Jonel was very kind and always made sure we were enjoying our evening. I would definitely recommend this place to others!,"Food - Amazing||Music - Live performance||Service - amazing, attentive with a positive attitude"
"1618 Asian fusion had great service! Shout out to Graham, Anj, Kiara and Bryan were so attentive. Super sweet, fast, and provided the best service at the bar top!

The Bao buns were delicious and General TSO chicken was fresh and full of flavor

The ambiance was super casual but lovely relaxing atmosphere, amidst the heavy traffic.","Food - Bao buns (delicious), General Tso chicken (fresh and flavorful)||Ambiance - casual but lovely relaxing atmosphere||Service - great, best service at the bar top, super sweet and fast"
"Huge menu.  Egg rolls for appetizer and Shrimp Panang Curry for main dish.

The egg rolls had a nice fry.  The combination of shrimp and pork worked well.

The shrimp curry started out great.  It was creamy with the right amount of spice.  It was a big dish and it got sweeter the more we ate.  The curry needed some acid or salt to balance the sweetness.  Exact same feedback for the vegetable curry.

In all a very good meal.","Food - Egg rolls (nice fry), Shrimp Panang Curry (started great but got sweeter, needed some acid to balance sweetness), Vegetable curry (started great but got sweeter, needed some acid to balance sweetness)||Menu - Huge"
"Came with friends for dinner on a Friday night. We had reservations for a table of 4. We were seated right away.

Our server greeted us promptly and had our drinks placed immediately. I tried the dragon fruit refresher and it was absolutely delicious!!

We split the appetizer for the table. I enjoyed the pork bun and the satays. The fresh spring roll, I would recommend, eating first because the wrap ends up sticking to the banana leaves and tears the longer you let them sit. I wish it was served with a peanut butter sauce, but it wasn't a deal breaker.

I ordered the green curry with filet mignon. Comes with steamed rice. The dish is so rich, but all I could taste was the smokiness of the steak. It overpowered the sweet curry. I liked that it had plenty of veggies and the steak was cut in bite sized pieces. It is on the spicier side, fair warning. You also can't adjust the spice level.

I tried my friend's crispy pad Thai, which was absolutely delicious. The sauce is rich and you can really get the lime flavor. It is pretty spicy though. I don't know if I'd be able to eat the whole dish, but it's yummy.

To get the spice out of my mouth, I ordered the Ube pana cotta. Oh my goodness!! This is such a stellar dessert!!! Ube was perfect. Not too sweet and the panna cotta was divine!!! I would go again just for this dessert.","Food - Dragon fruit refresher (absolutely delicious), Pork bun (enjoyed), Satays (enjoyed), Fresh spring roll (recommended but sticks to banana leaves if not eaten first), Green curry with filet mignon (rich with overpowering smokiness of the steak, on the spicier side), Crispy pad Thai (absolutely delicious but pretty spicy), Ube panna cotta (stellar dessert, perfect ube flavor, divine)||Service - Friendly and sweet"
"I've been here so many times I feel like I've tried everything on the menu at this point.
For the new things: we tried the beef skewers and although they were tasty they had a very strong, specific flavor to them with the fish sauce and Thai basil wrapping (I think?). Not necessarily something I'd order again. Along with that, we got the crispy pad Thai which id never had before - the crispy noodles were not my thing but the flavor of this dish was fantastic honestly. Trying to figure out how we get these flavors on their regular pad Thai!
Our go tos:
1. Soup Dumplings
2. Duck skewers
3. Salt & pepper calamari
4. Coconut fried rice
5. Pineapple fried rice
6. Shrimp panang curry
7. Filet mignon with onion

Make a ressie - you'll need it...but either way, go here. Fantastic food. Always great service. Plenty of parking and nice ambiance.","Food - Beef Skewers (tasty but very strong flavor), Crispy Pad Thai (crispy noodles not good but flavor was fantastic), Soup Dumplings (good), Duck skewers (good), Salt & pepper calamari (good), Coconut fried rice (good), Pineapple fried rice (good), Shrimp panang curry (good), Filet mignon with onion (good)||Service - great||Parking - plenty||Ambiance - nice"
"DEEE-LI-CIOUS!
Once you get past the slightly odd location in an apartment complex, the actual ambiance of the place is great. There's parking garages to park in for free so no issues there.
We started with the salt and pepper calamari along with the duck skewers. I'm not a huge fan of duck but with so many reviews on this dish, I had to give it a try and it was honestly delicious. Wasn't ""duck"" tasting at all! The calamari was also good and exactly what you would expect but I would have preferred a bigger portion for the price.
We then ordered the chicken pad Thai, seafood fried rice served in a coconut and the red curry with chicken. All 3 entrees were absolutely delicious with the perfect amount of heat for me without asking for any adjustments.
I would order the exact same meal again if I had to but ofcourse next time I'll want to try some of their other dishes as I'm sure they'll be as good!
Lastly, service was excellent. Our server was informative and very welcoming - cherry on top!","Food - Salt and pepper calamari (good but small portion), Duck skewers (delicious), Chicken pad Thai (absolutely delicious with perfect heat), Seafood fried rice served in a coconut (absolutely delicious with perfect heat), Red curry with chicken (absolutely delicious with perfect heat)||Location - odd||Ambiance - Great||Parking - free||Service - Informative and welcoming"
"This extremely modern restaurant has a great ambience with exceptional service. If you're looking for a spot for a date night or with friends, this is the spot for you! Food is flavorful, yet expressive and traditional!","Food - Flavorful, expressive and traditional||Ambiance - Great ambience||Service - Exceptional"
"I really enjoyed this hidden gem. The service was great and the food was too. There is parking in the retail garage across from it. If you're looking for a cute date spot, I think this is a good option.",Food - Great||Service - Great||Ambiance - Cute
"I recently dined at 1618 Asian Fusion in Austin, and I must say, it was an exceptional experience. From the moment I walked in, I was captivated by the inviting ambiance. The restaurant's decor exuded a warm and modern charm that set the perfect tone for a delightful evening.

Now, let's talk about the star of the show - the food. The menu at 1618 Asian Fusion offers a diverse range of Asian cuisines, and every dish we ordered was an absolute delight. The flavors were a symphony of tastes that left our taste buds dancing with joy. The presentation of each dish was impeccable, demonstrating the kitchen's commitment to both taste and aesthetics.
Show shopper dishes and must try - Banana Leaf salmon, Flambeau Cheescake, tempura Tofu

But what truly elevated our dining experience was our server, Ana. She was not only attentive and knowledgeable about the menu but also displayed a genuine passion for ensuring our meal was a memorable one. Her recommendations were spot-on, and she went above and beyond to cater to our needs. Ana's friendly and warm demeanor added a personal touch that made us feel like valued guests.

In summary, 1618 Asian Fusion in Austin is a gem for food enthusiasts looking for an outstanding culinary adventure in a tastefully designed setting. The combination of delectable cuisine, a cozy ambiance, and the exceptional service provided by Ana make it a must-visit destination for anyone seeking a memorable dining experience. I can't wait to return and savor more of their incredible dishes.","Food - Banana Leaf salmon (must-try), Flambeau Cheesecake (must-try), Tempura Tofu (must-try)||Service - Exceptional, attentive, knowledgeable, genuine||Ambiance - Inviting, warm, modern charm"
"The wait was really long, so we put our name down and left, but about 30 minutes later we were able to be seated at the bar.

They had some really cool looking drinks what fruit around the display case, if you want something alcoholic to try. There was so much on the menu I wanted to get, but we agreed on the pho with short ribs and filet and the stir fried filet dish.

I like how they pour the broth at your table. The meats for both dishes were flavorful and tender. The soup broth was delicious as well. It was fun interacting with the bartender too. She was so friendly and sweet.","Food - Pho with short ribs and filet (flavorful broth, tender meats), Stir fried filet dish (flavorful and tender meats)||Drinks - Cool looking||Service - Friendly and sweet"
"1618 is a nice restaurant for an occasion, but overrated in my books. Definitely make a reservation before you go.

The food is tasty and the service is really solid, but the price for the portion is not so good. I was excited about the shrimp but you only get 5 pieces. Perhaps the best thing to get is the crispy pad thai, because it's something novel where the noodles are fried. Other things I tried could be found elsewhere in larger quantities at a less fancy place. Nonetheless, it's quality stuff and their cheesecake makes you feel classy.

There's free parking in the garage in the back.

I'll be back for another birthday dinner!","Food - Crispy pad thai (novel concept with fried noodles, tasty), Shrimp (tasty but small portion)||Service - solid||Price - high||Parking - free"
"I love the Peking duck here! Probably my fav Peking duck in Austin. It'd be great if there was an option to sub buns for crepes though :) the coconut fried rice was okay, not my favorite. It had some Tom-yum flavor, which I usually like for soup but tasted a bit strange for rice. 10/10 for presentation of the fried rice though. Good service, very friendly servers. Nice ambiance. I would definitely come back!","Food - Peking duck (favorite, prefer option to sub buns for crepes), Coconut fried rice (okay, Tom-yum flavor tasted strange for rice, perfect presentation)||Service - friendly||Ambiance - nice"
"My goodness. I'm a fan. The ambiance is upbeat and a bit loud at times, but it's wonderful for a dinner date. The xiao long bao is a MUST! The five sampler is a good portion to split with someone and it's nice to try a bit of everything!

The Pad Thai is good, but the next time I come I have to explore some newer options here. I wish I saved some room for dessert because that also looked incredible at the neighboring tables.

Big fan and will go again! Be wary of a bit of a wait time during peak dinner hours!

Cheers!","Ambiance - Upbeat, bit loud, wonderful for dinner date||Food - Xiao long bao (MUST try), Five sampler (good portion to split), Pad Thai (good)"
Wonderful food and excellent service from Ana! She was so knowledgeable and had a positive vibe. The ambiance was perfect! Definitely coming back.,"Food - Wonderful||Service - Excellent, knowledgeable, positive vibe||Ambiance - Perfect"
"Visited 1618 for dinner during my visit after seeing it on Yelp's Top 100 list! We made a reservation a few weeks out. It's beautiful inside, and our server was extremely friendly and helpful.

My one gripe is that they don't offer any modifications to the majority of their dishes - I totally understand from a chef perspective, but as someone with dietary restrictions (and a low spice tolerance!!) it made it difficult because we couldn't order a few of the things we initially wanted to and had to pivot.

We split the house fried rice. It was delicious, but we were really hoping to try the more exciting pineapple or coconut ones - neither of which could have the spiciness removed so we opted out. I liked that we could get a combo of chicken, shrimp, and beef. We both agreed that the beef was our favorite.

I got the duck skewers, which were AMAZING. I just wish they were bigger!!! The dipping sauce they came with was perfect too. So tender and flavorful.

My friend ordered steamed dumplings. They were rainbow colored, and I'm not sure how they make them colorful so it kind of freaked me out a bit since I try not to consume artificial coloring, etc. I did try one and felt it was too chewy for my liking - I probably would have preferred them fried.","Food - House fried rice (delicious), Duck skewers (AMAZING, small portion), Steamed dumplings (colorful, too chewy)||Service - friendly, helpful||Ambiance - Beautiful"
"I completely understand why this place was on the top 100 restaurants in the country list. It's awesome.

Ambiance: Tucked away on Riverside, large wooden doors lead to a beautifully lit dining room, intimate bar and stunning decor. Each table is decorated with greenery.

Service: The staff is pretty attentive, no complaints. They take time to explain the menu and give suggestions. I've only had subpar service once.

The goods: I've had everything from the curries to fried rice, summer rolls, salt and pepper prawns and pad Thai. Everything was delicious, though the curries tend to be on the sweeter side.

I can't wait to dine here again.","Food - Delicious, curries tend to be on sweeter side||Ambiance - beautifully lit, intimate bar, stunning decor||Service - attentive, helpful"
"We were very impressed! They were able to seat us without a reservation. Everything was delicious! I loved the long bao and egg bao! Orange chicken was great too.
Our server Liz was great! We will be back","Food - Long bao (loved), egg bao (loved), Orange chicken (great)||Service - great"
"It pains me to write this review but I have waited long enough to do so. We used to love coming here, definitely one of our favorites and recommended it to so many. The special memories we have made here will last forever. However, now when I pass the restaurant I get a little queasy, a little sad, and not mad... but definitely dissappointed.

The last time we visited here, we brought a guest with us and we had a fantastic meal. However, all three of us became very ill within the next 24 hours. 100% food poisoning. It hit me the worst, because I was pregnant on top of it and ended up in the emergency room all night. Thankfully our guest didn't have it hit her until her plane landed back in her home state. I felt awful for taking her somewhere that ended up making us all sick, although I know anything can happen anywhere and it isn't necessarily a reflection of the establishment. We have never had an issue there any other time.

The problem was their reaction to this when we called them to let them know that others might be I'll as well and we wanted to give them a run down of what we ate so they could figure out what it was. The original person we spoke with was more than apologetic and ready to help but whoever he gave the information to, was not. They quite literally tried to blame us and say it was probably food allergies. Yes, all three of us suddenly have a good allergy we never knew about and all of us have the same one with the same reaction and it only hit us after eating at your restaurant. We had to stay extremely persistent to get any kind of help in the situation.

I miss their great food and violin events, but haven't been able to get myself to go back after their reaction to such a disappointing experience.",Food - Food poisoning
"We have been passing by this time and time again and wanting to go, yet just never made the move! Well my husband finally took me for a nice dinner and my oh my were our mouths and bellies thankful for the experience! And ""experience"" is the only way to describe this! Our first visit, our server was amazing and so helpful with recommendations- she actually convinced me to order something completely different just by her passion for this specific dish. We started the with soup dumplings and actually had no idea how to eat them - but you can find anything on YouTube these days right? I'm being 1000% serious, I totally searched in on YouTube so we could properly eat these dumplings. When I say I could quite literally just order multiple orders of the dumplings and eat them as my appetizer, meal, and dessert.... I mean it. The calamari was  seasoned to perfection and so satisfying. I'm fairly certain I got a box for two pieces of calamari. That's just silly to you if you haven't had it before... but once you have it, you, too, will not let it go to waste. The dipping sauce was the perfect match. For dinner, I got the Filet Green Curry and WOW , this was just the right dish for me, not too spicy, enough to save for second meal the next day (which was gold) - and very flavorful! My husband was the winner here, he got the Pho Rib (served with a filet) and DAMMMMNNNNN GINA! The presentation, the taste, the impending doom we both felt as the dish came near its end- because that flavor deserves to be tasted forever.  This dish was the star for sure!

We went back again on Christmas Eve for an incredible evening with Omar Phoenix playing the violin and we sat and ate and drank and melted in the presence of this incredible artist for four hours. I could write about that night alone forever but then I might need a publisher and a pen name. Magical. This place is absolutely magical.

Pro tips: the old fashioned is $18 but it's prepared tableside in a smoker and it's a whole thing! We enjoyed them. The five sampler: totally worth it. Eat the soup dumplings and watch youtube to do it properly. Your server can be amazing or mediocre but the food will always satisfy. If Omar is playing, make reservations, bring your friends, and go! Someone at your table MUST order the Pho Rib. That is a non negotiable.","Food - Soup dumplings (recommended), Calamari (seasoned to perfection, satisfying), Filet Green Curry (flavorful), Pho Rib (star of the meal)||Drinks - Old fashioned (worth it)||Service - Amazing, helpful with recommendations||Ambiance - Magical atmosphere, incredible evening, Omar Phoenix playing the violin on Christmas Eve"
"I get takeout here all the time!

The Tom Kha soup is one of my favorites and it's really good here! The only downside is that you have to order rice and it isn't included in the price of the soup.

The soup has a lot of mushrooms in it here so if you are not a fan of those, I would not recommend. Also I will add that sometimes the mushrooms look like the chicken / it was hard for me to distinguish so I wouldn't count on being able to pick them out!

I have never actually eaten at the Restaurant, but it looks nice! It's in a sort of apartment complex strip, I'm guessing they have retail parking since spots are pretty limited, but I would double check before coming next.","Food - Tom Kha soup (favorite, rice not included, lots of mushrooms, hard to distinguish mushroom from chicken)||Location - in an apartment complex strip||Parking - limited parking spots"
"The ambiance of the restaurant was amazing. Wall was lined with sansaverrias and good mood lighting. Large wine rack decor in the middle of the restaurant floor. Service was good and attentive keeping our waters topped off. Wait time to get a seat was a bit long, but plenty of space outside to wait.

Came here for my dad's belated birthday and he was able to get a dessert which was this decadent taro flan.  But first started off the meal with the spicy Saigon chicken wings. They had a real nice crispy skin and right amount of fire. Then had duck four season which was served with lychee and longan for that sweet and savory taste. No bao buns like your usual Peking duck dishes. But the duck was cooked nicely and still really moist. We got the salted pepper shrimp, pineapple fried rice, and oxtail pho since my dad really wanted to try the oxtail. He was thoroughly impressed even though he knows how to make his own pho at home. The meat falls off the bone and the broth tasted rich yet clean. Fried rice wasn't a big portion and served in a pineapple but still really good fried rice!

Overall enjoyed my experience and would be back if I lived in Austin!","Food - Spicy Saigon chicken wings (nice crispy skin, right amount of fire), Duck four season (cooked nicely, moist), Salted pepper shrimp (impressive), Pineapple fried rice (good, small portion), Oxtail pho (impressive, rich yet clean broth)||Ambiance - Amazing, sansaverrias lining the walls, good mood lighting, large wine rack decor||Service - Good, attentive"
"Soup Dumplings were very good. The tofu summer roll was easily the best I've ever had. I don't do them often because they aren't usually so flavorful. Green curry was great. Had a healthy curry sweat as I wrapped up my dinner. Wine list vast, as the drink list and deserts. Next time I will get more into those parts of the menu and the live music nights sound right up my alley.
Service was great. Absolutely no complaints about anything.
Thank you 1618!","Food - Soup Dumplings (very good), Tofu summer roll (best ever, flavorful), Green curry (great)||Drinks - Vast wine list||Service - Great"
"Great service, good vibes, delicious food!
Waiter gave us great suggestions, the salt and pepper prawns and pineapple fried rice. We also had an ube shot that was yummy. Second time here even though i don't live in austin, this place is definitely worth checking out!","Service - Great, great recommendations||Ambiance - Good vibes||Food - Salt and pepper prawns (delicious), Pineapple fried rice(delicious)||Drinks - Ube shot (yummy)"
"The food is soooo good! I'm kind of picky in terms of Asian fusion, but 1618 actually did the fusion pretty good. It kept the original taste of all the dishes that we ordered. The Yellow Curry with Shrimp is very good, very Thai in my opinion, as well as the pepper steak, very Chinese. Good quality meal in a nice restaurant. The live music is great, not too loud, which is perfect. I really enjoyed the music and the food. I have to say the boss has a pretty good taste.
Hmmmm, coconut fried rice is over priced. You could order something better at this price.
Overall is good, will be back for sure!","Food - Yellow Curry with Shrimp (very good, Thai flavor), Pepper steak (very good, Chinese flavor), Coconut fried rice (overpriced)||Ambiance - live music is great, music not too loud"
Loved the food. Loved the service. Loved the vibe. This place has everything you're looking for in Asian cuisine. Loved the shrimp and pork dumplings and the chicken xiao long bao. The pineapple fried rice was yummy. The star of the order was the crispy chicken pad Thai. So so good. I'd go here again. Squid calamari was great too. The sauce that came with it was outstanding!,"Food - Shrimp and pork dumplings (loved), Chicken xiao long bao (loved), Pineapple fried rice (yummy), Crispy chicken pad Thai (star of the order, so good), Squid calamari (great, outstanding sauce)||Service - Loved||Ambiance - Loved the vibe"
"It was my last day in Austin and my friends decided to come here for one last chow for me.

It definitely wasn't a disappointment and I would definitely come back here.

I ordered their beef rib pho and Holy mother of all that's delicious....it was quite divine. The meat was tender and literally slid right off the bone. The fact that they pour the broth in front of you is a plus because I actually like a nice show with my food lol.

I do recommend everyone to give them a try, it's definitely worth it","Food - Beef rib pho (divine, tender meat, broth poured in front adds to experience)"
