Comments,Output
"To start, we ordered the calamari and the dragonfruit rose refresher, both of which were delightful. The calamari was perfectly crispy and flavorful, while the refreshing dragonfruit rose refresher was a great choice to complement our appetizer.

For my main dish, I opted for the Pineapple Fried Rice, and it was absolutely delicious. The combination of juicy pineapple, tender rice, and well-balanced flavors made it a standout dish. I thoroughly enjoyed every bite!

What made the experience even better was the exceptional service from our waiter. They were genuinely nice, attentive, and ensured that we had everything we needed throughout our meal. Their friendly and professional approach added to the overall enjoyment of our dining experience.

The ambiance of 1618 Fusion was also noteworthy. The music playing in the background created a pleasant atmosphere, and the overall vibe of the restaurant was on point. It contributed to a relaxed and enjoyable evening.","Food - Calamari (crispy and flavorful), Dragonfruit rose refresher (refreshing), Pineapple fried rice (delicious)||Service - Exceptional service from waiter, friendly and professional||Ambiance - relaxed, enjoyable "
The food was really good. They don't do much substituting but the taste is really nice. Love the ambiance. Key lime pie was outstanding,Food - Key lime pie (outstanding)||Ambiance - Loved
We love the Dim Sum brunch here! Especially the Xiao Long Bao and Sui Mai! Shyra was a wonderful waitress as well,"Food - Xiao Long Bao(loved), Sui Mai(loved)||Service - wonderful"
"1618

1618 is hands down one of the best restaurants in Austin.

I have been here probably 10-15 times by now and the food never disappoints.

They have an unbelievably good happy hour ($6 cocktails!) and the food is overflowing with flavor.

I have had just about everything here but i would recommend going with a Curry (yellow is my favorite) and either Pad Thai or a Filet Mignon Stir Fry.

The desserts are nothing to be missed too. I have had the chocolate cake (not the exploding lava one) and it is just immaculate.

Probs to this family owned business for making an unbelievably tasty offering at a solid price point! The atmosphere is so great as the restaurant is packed 24/7!","Food - Yellow Curry (recommended), Pad Thai (recommended), Filet Mignon Stir Fry(recommended), Chocolate cake (immaculate)||Ambiance - Packed restaurant, great atmosphere"
"One of the best combinations in town for Flavor, Ambiance and Service.  Keep going back there for their Dim Sum and live music!",Food - Dim Sum brunch (favorite)||Ambiance - live music
"I usually never leave yelp reviews but wanted to leave one for my girl Shaira who was so great in terms of the service. The vibe is amazing, you will love it here. Great for dates, literally anything I came alone and had a great time. I had the five sampler because I wanted some bao buns and honestly I took a chance because I don't really eat meat. I didn't enjoy it much but I think it really just depends on what you like. I did enjoy the calamari very tasty. The THAI ICED TEA AND THE MANGO STICKY RICE were literally TO DIE FOR. Highly suggest those. Thank you Shaira and to this place for great late night vibes. Shaira did say the crispy chicken pad Thai was bomb and I didn't get to try but honestly I suggest it lol. I know it would be good","Food - Five Sampler(good), Calamari (very tasty), Thai Iced Tea and Mango Sticky Rice (highly recommended)||Service - excellent, amazing vibe"
"If they have a membership program, I'll probably become a gold member soon. I come here every week and try out new dishes every time.
Eruption chocolate: huge portion. You might want to share it with someone. It's not a 5-star though. There's not much chocolate oozing out of the cake. It's a little bit too sweet.
Crab fried rice with truffle: it's not on their regular menu. You will find it on happy hour menu. It's amazing. The portion is not too big, but it's an enjoyable size","Food - Eruption chocolate (huge portion, bit too sweet), Crab fried rice with truffle (amazing)||Ambiance - Enjoyable"
"Duck curry: yummy. Perfectly balanced. It's not too greasy. I wish there's more duck meat though.

Coconut fried rice: coconut smell overwhelmed in a good way.

Duck dumpling noodle: it's a 6/5 dish. There's nothing to complain about. It's authentic. Again, I wish there's more duck meat though, but duck is pricey to begin with, so I understand why they didn't put too much in.

Pho 75 during happy hour: BE AWARE. the portion is for kid (or merely an appetizer for an adult). The bowl is super tiny. I can't complain on the quality though, it's not authentic but still super tasty.

Mount Everest Cheesecake: it comes with a show. They burned the wine on the cheesecake and then extinguished the fire with ice cream. It's super delicious though. It's a bit pricey but you will get a whole show. I say it's so worth the price.","Food - Duck curry (yummy, perfectly balanced), Coconut fried rice (pleasant coconut aroma), Duck dumpling noodle (authentic, exceptional), Pho 75 (small portion, tasty), Mount Everest Cheesecake (delicious, bit pricey)"
"I think I made a bad choice, Both dishes are full of coconut flavors, so together it's super fatty (in a good way though).
This is a nice fancy Asian restaurant, but the price is still very reasonable for the quality.
The restaurant is huge. It's well decorated.
10/10 for the service. Everyone is friendly, from the host to the server to the bartender. There's nothing to complain.
I'll be back to try the Peking Duck and the dessert.
I saw a plate of lava cake and ice cream, it look too good to be true, unfortunately I was to full to try it. There will be a next time.","Food - super fatty||Service - perfect, friendly||Ambiance - well decorated||Price - reasonable"
"I measure an Asian restaurant by how they make their Pad Thai and this place makes a delicious Pad Thai. It was the right amount of tangy, spicy and crunchy. Our server Ana was very friendly and accommodating. Thank you.","Food - Pad Thai (Delicious, right amount of tangy, spicy, crunchy)||Service - friendly, accommodating"
"At this point, I'd consider myself a regular. 1618 is always one of the places I recommend friends visit and it's always somewhere I bring family.

The food is not too expensive, the ambiance is relaxed but lively and the staff is amazing - especially Christian and our waitress!

The Calamari is amazing and they have the best duck! I'll definitely be back.","Food - Calamari (amazing), Duck (best)||Service - Amazing||Ambiance - relaxed, lively"
"This unassuming strip mall (with limited retail parking) under the AMLI apartment building off Riverside Drive went under my radar for far too long! I'd ordered some 1618 via ubereats, and when that went well (but not before showing up unannounced to discover this spot already had enough street cred to generate a sizeable wait time), we called ahead and found free spots at the bar one night to have our maiden in-person experience here!  

From the dÃƒÂ©cor to the hospitality, the mood was set. Loved the interesting lines of the interior design and the wine room in the midst of the dining room! There's even a stay for... live music and other acts?! Yesss!

And on to the food. Since we'd had to wait a hot minute, we decided to share a smattering of options. And when I say this place has food on par with Lin Dim Sum and Julie's Noodles, I MEAN IT!

The scallion pancakes are instantly (and maybe permanently) my favorite of anywhere I've had them. Usually super-thin and crispy and far from substantial, the scallion pancakes here were pillowy-soft, dimensional, and oh so divine!  Will ALWAYS get more in the future! -- 14/10

The pork, shrimp & shiitake Sui Mai (3-pc order) were ample and well filled, but I've just never been big on this flavor combo, though I'd still say they were ""pretty good"" -- 8/10

Now dem Xiao Long Bao (5-pc order)... holy pork soup dumplings on a spoon...!  I'd say on par IF NOT BETTER THAN Lin/ Julie's. Bigger bite for sure, and I think I could easily take down a few orders solo!  Definitely contenders here, and they've got these on the Dim sum brunch menu for a STEAL at $11! -- 14/10

The clay pot sticky rice I was ""meh"" about, I think mainly because I'm not big on Chinese sausage... but my honey liked it quite a lot!  -- 7/10 (for me)

Mango sticky rice was served beautifully, but I didn't love it. I dunno why... I'll try it once more before I even rate it..  maybe it just failed to be amazing following one of the best desserts of my life--

The Flambeau Everest cheesecake, fired with vanilla honey liqueur, cinnamon is sprinkled over it as the flames engulf the plate & topped with a scoop of coconut pineapple ice cream...... OK I need to go get another one soon after describing it alone!  I am a cheesecake aficionado, and this one absolutely, unequivocally takes the LITERAL cake!  What a whirlwind of unexpectedly epic deliciousness on a spoon!  -- 15/10

Seriously.
Deliriously.
Divine!","Ambiance - Interesting interior design, live music||Food - Scallion pancakes (favorite), pork, shrimp & shiitake Sui Mai (ample, well filled), Xiao Long Bao (delicious), Sticky rice (meh), Mango sticky rice (beautifully presented, didn't like), Flambeau Everest cheesecake (delicious)||Service - Great"
"Took my family for an early Mother's Day. The live music was amazing and created an amazing vibe for the restaurant. It is such a homey yet up-scale place that was beautiful.

We ordered calamari and grilled octopus. The batter for the calamari is soooo good and the salt,pepper,lemon dip adds the best type of flavor. The grilled octopus was on a stick and had a good Smokey flavor. Both great. We also ordered the papaya salad with shrimp. It was very refreshing and crunchy with the fish sauce smell but not super overpowering fish sauce taste. Very good!

For mains we got the L redfish and duck fried rice. So so so good. Only thing is I wish the tables were a little bigger since their food is a lot of family style options. But the food was amazing. The redfish belly was so so caramelized and crispy. I will now always crave this. The fried rice was good flavor. Very authentic since I'm very picky about fried rice. I was able to take both's leftovers to go and it was just as good the next day. We also got some stir fry which has good flavor and came with white rice.

We ended with the flaming cheesecake. Our server did it table side and it was an entertainment in itself. Very good and light.

Our server was great as all. Very attentive. The place is pretty busy so he was always running around, but overall he was able to answer all our questions and keep us satisfied for dinner.

Highly recommend this place","Food - Calamari (delicious batter), Grilled octopus (good smokey flavor), Papaya salad (refreshing), L Redfish (caramelized, crispy), duck fried rice (amazing), stir fry (good flavor), flaming cheesecake (very good, light)||Ambiance - Homey yet upscale, live music, great vibe||Service - Great, attentive"
"Management - Please Read! Nobody needs or wants to hear a violin at 1000 decibels as they try to have dinner on a Thursday night in an Asian restaurant. It's piercing, it's annoying. Even worse it's so off tune. The severs are yelling at you. The music is way over amplified. If I wanted to go see a concert I'd be at a concert. Otherwise I love this place and I'm so bummed that management lacks any sort of sense of what a guest wants to experience when coming out for a nice dinner. This is TOO much.",Ambiance - music is too loud and off-tune
Red curry with duck was great. I made it a little bit spicy (4/5) and it has a great kick. Great portions too. Thanks to Shaira for the great service.,"Food - Red curry with duck (great, spicy, satisfactory portion sizes)||Service - great"
"Very delicious. Their weekend brunch is great too.

My favorites:
The beef vermicelli noodle. The flavor is umami rich.
Their house fried rice.
Bun with egg yolk - sweet.
Soup dumplings on the weekend.

Very good service too!!!","Food - Beef vermicelli noodle (rich flavor), House fried rice (delicious), Bun with egg yolk (sweet), Soup dumplings (favorite), weekend brunch (great)||Service - Very good"
"The food was ok, but nothing spectacular. I have probably been spoiled by Cali Asian cuisine. I have had much better. Don't let the high ratings fool you too.

We ordered the appetizer sampler. My companion hated the pork and gave them all to me. I thought the best item was the egg rolls but how can you screw those up. Papaya salad was good but again, pretty standard Asian fare.

Service was ok. Server was a bit robotic when we were asking for recommendations.

Restrooms were nice but smelled weird. Skip and go to some place else.","Food - appetizer sampler (mixed reviews), Papaya salad (good), Egg rolls (best item), Pork (hated)||Service - Okay, robotic server"
"1618 Asian Fusion is an upscale Asian fusion restaurant that takes the best parts of common Asian dishes and elevates them.  This is not your mom's Vietnamese pho, and that's a good thing.  Some purists may not like the elevated twists, but to me 1618 is worth a visit.

My Overall Rating - 4 Stars (Atmosphere, Service, Food, Return)

Atmosphere - On the outside, 1618 Asian Fusion is as unassuming as it's name.  But inside it's a large, open space.  There's a desk dedicated to To Go orders (expertly packaged), and a stage that features live entertainment.  We were treated to a fantastic acoustic set which really accentuated the cool vibe.  1 Star.

Service - Our server was very good.  Attentive, friendly, and a great conversationalist.  No issue at all.  I would have liked the servers to explain the dishes that we ordered, since this is a high end restaurant with unique dishes.  1/2 Star.

Food - The word Fusion is in the name of the restaurant because Asian Fusion serves dishes inspired from many Southeast Asian Countries like Vietnam and Thailand.  I started with the Fried Calamari, which is served in a traditional Vietnamese style. The outside was light and crispy.  I loved it because it was the perfect example of taking a traditional dish and elevating it.  The Pho Rib is served with huge beef ribs and the pho broth is poured over in a tea kettle.  Again, this is not your mom's pho.  It was elevated and familiar at the same time.  The only letdown was the Pineapple Fried Rice.  It was just ok - order it for your IG feed, not your belly.  I have to give a bonus shout out to the To Go order.  We ordered a Pho Combo to go, and they expertly packaged it up.  Finally, Asian Fusion isn't cheap.  Don't except to eat the pho every day.  1  1/2 Stars.

Will I Return? - Yes.  The atmosphere is great.  The service is great.  The food is familiar and unique at the same time.  There are many more dishes I want to try.  I'll be back. 1 Star.

My Yelp Rating Scale (Sum of all parts):
1 Star - Atmosphere - Is it a cool dive?  Perhaps an upscale place?  No matter the type, atmosphere plays a big part and I'll give a star if I like it or thinks it has great charm.
1 Star - Service - You can have a great meal with bad service.  But that's also what can make a five star joint drop to four.  It's important to the dining experience that service is great and on point.
2 Stars - Food - I'll award up to two stars for the food, since this is the main reason we dine out.  Sometimes the extra star is given for value, but it's really all about the food.
1 Star - Will I come back? - If I know for a fact I'll return, I'll give this a star. A place has to make an impression for me to return.

Each Category can be given up to 1 star except food (2 stars) because I consider all these categories important to the overall dining experience.  I will sum them up to provide my final Yelp score.","Food - Fried Calamari (perfect example of taking a traditional dish and elevating it), Pho Rib (elevated yet familiar), Pineapple Fried Rice (just ok), Pho Combo (expertly packaged)||Ambiance - Large, open space, live entertainment||Service - Attentive, friendly, didn't explain the dishes"
"One of thee best asian Thai restaurant in austin!!  I come in once a month for sure!!  or every other week!! Service fast friendly! Cute Ambiance , comfortable seating with good vibe! some nights a band plays music so beautifully .
My food rating out of 5!

Tom Yum- 5/5
Banana, salmon-5/5 i  got my sauce on the side
Coconut rice / 5/5
Lamb /5/6 cook just right!!
Drinks always made good!

Definitely recommend coming here!","Food - Fried Calamari (light and crispy outside), Pho Rib (elevated, huge beef ribs), Pineapple Fried Rice (just ok), Tom Yum (high ratings 5/5), Banana salmon (high ratings 5/5), Coconut rice (high ratings 5/5), Lamb (ratings 5/6)||Ambiance - Cute, good vibe, live music||Service - Fast, friendly, attentive"
The food was AMAZING!! Our server Yvonne was so great! Very attentive and super friendly! We will definitely be coming back.,"Food - AMAZING||Service - friendly, attentive"
"Very solid! I was a bit skeptical to be honest given the fusion aspect of this place with its broad pan-Asian menu but consider me impressed! The oxtail in the oxtail pho was cooked well and the meat was incredibly tender. I'm looking forward to trying the beef rib pho next time (though I might need to show a bit earlier since apparently they run out of it).

My friend had the crispy chicken pad Thai and I thought that dish was definitely a standout. I normally am not big on pad Thai but in all honesty, it didn't taste like pad Thai at all (which to me was a good thing). It was definitely a crispy version of something Thai-tasting but without the sour flavors of fish sauce and vinegar, so maybe more like a crispy pad woon sen or crispy pad thai? Either way, it was A+.","Food - Oxtail pho (cooked well with tender meat), Crispy chicken pad Thai (standout, not like traditional pad Thai, very delicious)"
"After my first visit I wasn't sure if I would return, I did. And I couldn't be more pleased! The dragon fruit drink was beyond delicious! The jasmine syrup was a bit too much. The spices were absolutely DIVINE! The waitstaff was attentive, respectful and all round stellar.
The only negative was the packed house was extremely hot. And the flamed drinks and burning of spice over cheesecake was difficult to tolerate. Being an asthmatic it was difficult to enjoy meal but I pushed through. I would ask they be mindful of guest that can't inhale smoke or are allergic to toxic smoke from burning food items. Covering the windows make eliminate excessive heat. Otherwise a well worth visit!","Food - Dragon fruit drink (beyond delicious, jasmine syrup a bit too much, spices DIVINE)||Service - Attentive, respectful||Ambiance - Nice, extremely hot inside"
"It took over 30 minutes to actually receive my original order. If waitstaff would just  ""listen"" vs leading a guest request, I would had the chance to actually taste my entree without a second order.","Service - slow, long waiting time for order, not attentive"
"1618 is great! A few stand out dishes I've had are the Vietnamese bowl with pork and egg rolls, and the soup dumplings. The soup dumpling broth was SO flavorful. Some of the classic dishes like sesame chicken and orange chicken aren't really worth the upcharge of it being in a more upscale restaurant since it tastes the same as any other Asian restaurant really. Ambiance is nice - we went on a Friday night and there was live music. Definitely a must visit for Asian food in Austin!","Food - Vietnamese bowl with pork and egg rolls (standout), Soup dumplings (flavorful broth), sesame chicken and orange chicken (not worth upcharge)||Ambiance - Nice, live music"
The food was great!! And Yvonne was an excellent server. I highly recommend the lemongrass pork spring rolls,Food - Lemongrass pork spring rolls (highly recommended)||Service - Excellent 
"I heard 1618 Asian Fusion is the sister restaurant to 888 Pan Asian Restaurant, so I had to try it out!

Coming in, the service is amazing. We checked in through our reservations made on Yelp and we're seated immediately. If you were a walk-in, there was about an hour wait. The restaurant was fancy and very nice, we also had live music! What I loved about the live music was that it wasn't so loud to where my table couldn't hear each other, it was great!

My family ordered Mi Kho, Filet Mignon Pepper Steak, Combo Fried Rice, Thai Crispy Red Snapper (size L). From all of the food we ate, the Thai Crispy Red Snapper was the best; It was large, crispy, and the tamarind sauce was yummy! The Filet Mignon Pepper Steak came second, the steak was delicious. The conbo fried rice was okay, not the best but good. The Mi Kho unfortunately was not the greatest; The sauce was too strong and it just tasted like someone poured a lot of soy sauce and the pork belly was off, it tasted like tofu.

Overall, I would come back to try more different items like their pho (which they're known for)! I would recommend the Red Snapper for sure :)","Food - Thai Crispy Red Snapper (best, large, crispy, yummy tamarind sauce), Filet Mignon Pepper Steak (delicious), Combo Fried Rice (good), Mi Kho (not the greatest, sauce too strong, port belly was off)||Ambiance - Fancy, live music, not too loud"
"Food (5/5 stars):
1618 Asian Fusion made it to Yelp's Top 100 US Restaurants list, so we had to try even though we had to get takeout and eat it on the plane  Their Pad Thai was an explosion of flavor -- citrus, spice, nutty, savory, sweet. And the tofu was cooked very well. It wasn't my absolute favorite Pad Thai, but it was still amazing and would want to try their eclectic range of dishes when I'm back in Austin.

Experience (5/5 stars):
* Price: kinda pricey, but worth
* Wait Time: we scheduled our takeout and it was on time
* Service: very good and friendly
* Ambiance: it's a nice, modern restaurant!","Food - Pad Thai (explosion of flavor, favorite), Tofu (cooked very well)||Price - high||Service - very good||Ambiance - nice, modern"
"Definitely late to the party coming here but so glad we did make it here on Valentine's Day. The place was decorated with hearts and 80's ballads were playing.

We started off with the 1618 egg rolls. Love the presentation of the dish and the egg rolls are definitely not what I expected. The rolls were tasty and crispy. Next, we tried the soup dumplings. Delicious. I like that they gave us a plate with sauces to dip in. Presentation was definitely on point with the next dishes. We tried the Tom yum fried rice, four seasons duck and pepper steak. Everything was full of flavor and I was worried about the duck being sweet with the lychee. It was not at all. It was very good. I am always afraid of trying Asian fusion places, but this place knows what they are doing. Presentation and flavor did not come short. They offer free garage parking.","Food - 1618 egg rolls (tasty and crispy), Soup dumplings (delicious, flavorful broth and sauces), Tom yum fried rice (flavorful), four seasons duck (flavorful), pepper steak (flavorful)"
"This restaurant is such a gem. In a shopping center with apartments above it, pretty limited parking, but always busy and for all the right reasons.
Ambience 10/10
Drinks 10/10
Food 10/10
Service 10/10
Do I need to say more? We have visited the restaurant a few times, and always had exactly the same top-notch experience. This restaurant does not have an ""off"" night. During one of our visits, we chatted with a waitress who said she's been working there for a few years and has no plans on leaving because she's been treated right by the owners. That just shows how good management trickles into all aspects of the business.
If you have never visited 1618, please make reservations and go. You will love it. Plenty of options for vegans and meat eaters. Amazing deserts. Highly recommend.",Food - 10/10||Ambiance - 10/10||Drinks - 10/10||Service - 10/10||Parking - limited
"1618 is always a solid restaurant. I remember the first time I went years ago, I was a bit skeptical as anything fusion usually tends to not be good when you try to do everything... 1618 is the exception to this. Despite doing a span of different Asian dishes, everything's is always consistently good. I have had their chicken red curry (beautifully plated with unexpected mushrooms), Peking duck (one of the best I've had, filet mignon pho (the most tender cut I'd meat), crispy fish (really unique with DIY rice rolls), among others...

I have also been for dim sum, which while good, is a bit overpriced. I prefer their regular menu.","Food - Chicken red curry (beautifully plated, unexpected mushrooms), Peking duck (one of the best), Filet mignon pho (tender), Crispy fish (unique with DIY rice rolls), Dim sum (good but overpriced)"
