Comments,Output
"Came here for the first time to celebrate my bf's birthday for the first time and just like the other restaurants in this group, enjoyed our meal.

Dumplings are the star of the show here so make sure you order some, especially the soup dumplings. We also ordered the mustard greens, duck pancakes, zha jiang noodles, and the whole fried fish. I'd probably skip out on the noodles next time, but everything was flavorful and delicious. FYI everything is served meant to share.

The restaurant is also gorgeous and they have enough seating for large groups if you reserve ahead of time. Another plus is an attached garage with free parking for dining guests.

The only reason why I'm giving it 4 stars is because I prefer the ""homestyle"" experience of dining at a Chinese restaurant. However, this place is definitely worth the visit!","Food - Dumplings (star of the show), Mustard greens (flavorful, delicious), Duck pancakes (flavorful, delicious), Zha jiang noodles (skip), Whole fried fish (flavorful, delicious)||Ambiance - Gorgeous, seating for large groups||Service - Excellent||Parking - free"
"This place was highly rated when I was looking for a dm sum spot in Austin. It was also highly recommended by a friend as well to stop by try. Glad we listened and decided to come. So let's get this review started.

Ambience:

The place was very modern looking and especially the decor inside. I loved how it looked. Beautifully designed and pretty dark inside. The seating arrangement was sort of bunched together a bit. Oh my... the chairs were really exquisite. It was comfy but also the design was pretty nice. I just really loved their decor.

Service:

We went when it just opened, so it wasn't that bad. You could make a reservation ahead of time, but it wasn't necessary at the time we went. We were greeted by the host and then seated at a table when we entered. Our waitress was really lovely too. She was wonderful and helpful as well. She was a real delight. The way to order here is almost like a typical dim sum place. They give you a set menu and then you basically just mark down how many orders you want on the menu. Food came out pretty fast as soon as you place your order on the paper. So it wasn't that long of a wait to fill our bellies.

Food:

Oh the food! What can I say about the food. Absolutely wonderful. We enjoyed every dish that we ordered. We also ordered the typical items that we usually order at dim sum. Luckily they had the items we always ordered. Their menu for dim sum was a bit restricted, but it still had a good amount of variety to it. We ordered harrow, xis mai, bbq buns, custard buns and a lobster filled dumpling I believe. We got that one because it was in the shape of a rabbit. Very cute! We left here with full and satisfied.

Would we come again? Probably if we come back to Austin to visit.","Food - Har gow (enjoyed, satisfied), siu mai (enjoyed, satisfied), BBQ buns (enjoyed, satisfied), custard buns (enjoyed, satisfied), lobster filled dumplings (enjoyed, satisfied)||Ambiance - Modern, beautifully designed, dark, exquisite chairs, bunched seating||Service - Lovely, helpful, delightful, fast"
"If you're looking for some up-scale Chinese food, Qi can certainly hit the spot. First of all, the ambience is really nice. Note that you'll probably need a reservation ahead of time. But if you are a party of 1 or 2, there's almost always immediate seating at the bar or area in front of the kitchen.

I haven't tried everything off their menu, but there are some major hits everyone should try:

Basil Chicken Dumplings - For a dish that frankly sounds unassuming, these dumplings are a knockout. Must try if you want dumplings. The sauce that comes with it enhances it to another level.

Shrimp Har Gow - These are just done really well. The shrimp inside tastes fantastic and the texture of outer starchy skin is amazing. Probably the best Har Gow I've tried.

Honey Akaushi Beef -  WOW. If there is anything that makes Qi deserving of the 5 star review, it is this dish here. I have never had anything like this. The beef is cooked so perfectly, with a nice outer crust. Once you bite into it, it is like an explosion of delicious beef flavor.  And the sauce is this well balanced mixing of honey and pepper that hits all the senses. My parents visited me in Austin and they were so impressed by this dish as well.

My only gripe with this restaurant is their pekin duck entree. Everything tasted great, but they only provided ~3-4 bao to make your duck ""tacos."" And if you want more, you have to pay $1.50 for each extra bao! I'm not sure why they are nickle-and-diming so hard for this bread. Other Chinese restaurants give plenty.","Food - Basil Chicken Dumplings (knockout, sauce enhances), Shrimp Har Gow (done really well, fantastic shrimp), Honey Akaushi Beef (WOW, perfectly cooked beef, delicious flavor explosion), Pekin Duck (great taste, limited bao)||Ambiance - Nice||Service - great||Price - Extra charge for additional bao"
"Always a good time and good food when coming here! Plan ahead & Make sure you make reservations so you're not waiting because there will be a wait, especially on the weekends.

The service here is always amazing, I love that they have whiskey cocktails Available and they make them well! Everything I've tried here is pretty darn good but my favorites are the truffle fried rice, singapore crispy whole fish, and their imperial Tofu!

Trust me you won't be disappointed","Food - Truffle fried rice (pretty darn good), Singapore crispy whole fish (pretty darn good), Imperial Tofu (pretty darn good)||Service - Amazing"
"A culinary delight awaits at this establishment, accompanied by attentive staff who gladly elucidate the diverse menu offerings. I relished the truffle egg fried rice and Shanghai dumplings - both a perfect match for my palate. My visit encountered no delays, and the interior's aesthetic charm, featuring subtle yet inviting lighting, left a lasting impression. Heartily recommended, this spot beckons with a warm ambiance. Without a doubt, I'll return for another meal whenever I find myself in Austin again!","Food - Truffle egg fried rice (relished), Shanghai dumplings (perfect match)||Service - Attentive, elucidate diverse menu||Ambiance - Warm, inviting interior"
"This restaurant has really yummy, cute food, mice devor and ambiance, and friendly staff. You can ask the waiter for what vegan options they have as they don't have a dedicated vegan menu, but can definitely male accomodations.

My friend likes getting the chicken rats or whatever they're made of. They are super cute!

I usually get vegan dumplings or salt and pepper tofu. Super yummy!","Food - vegan dumplings (yummy), salt and pepper tofu (yummy)||Ambiance - Nice décor||Service - Friendly, accommodating||Menu - No dedicated vegan menu"
"For me, Qi is a great spot for a variety of Dim Sum small plates, shareable entrees, and a cozy / dimly lit evening out.

I definitely recommend their house special soup dumplings, truffle fried rice, and the whole fish (photo attached). The presentation, portion sizes, and quality of food do not disappoint. I think it's a great spot for a date night, evening with colleagues/clients, or any time you want to splurge or impress.

Make a reservation in advance, and be sure to check in up front with the staff when you arrive! Plenty of complementary parking spots on the fourth floor of the adjacent garage behind the front of the restaurant.","Food - House special soup dumplings (great), Truffle fried rice (recommended), Whole fish (recommended)||Ambiance - Cozy and dimly lit||Parking - Complementary spots available"
"We really wanted soup dumplings, so we went for lunch and stopped by this place. This place is very nicely decorated. All the details are thought out to the smallest detail. We were not greeted with a smile, but were immediately asked if we had a reservation. The service was not very good. No one asked if we wanted drinks. The drinks we ordered never arrived and I had to ask for them a second time. The soup dumplings were actually very tasty. The entrees, on the other hand, were flat. We ordered the chicken with pine nuts and the Berkshire pork, but it was just not flavorful. Maybe we ordered it wrong. Hard to tell as the staff didn't give us any instructions.","Food - Soup dumplings (very tasty), Chicken with pine nuts (not flavorful), Berkshire pork (not flavorful)||Ambiance - Nicely decorated||Service - Lackluster, no smile, slow||Drinks - Ordered but never arrived"
"Shanghai Soup DumplingsSzechuan Peppercorn AlligatorTruffle Fried RiceHar GowLobster DumplingsPan Sear Basil Chicken DumplingPecan ShrimpPot StickersSalt and Pepper Lobster tail
These are all my favorites","Food - Shanghai Soup Dumplings (favorite), Truffle Fried Rice (favorite), Har Gow (favorite), Lobster Dumplings (favorite), Pan Sear Basil Chicken Dumpling (favorite), Pecan Shrimp (favorite), Pot Stickers (favorite), Salt and Pepper Lobster tail (favorites)"
"The atmosphere is so amazing and the food and service are top notch  
Reservations is adviced !",Ambiance - Amazing||Food - Top notch||Service - Top notch
"Upscale Chinese fusion restaurant with beautiful ambiance, but a hefty price tag. I've dined here twice and my opinion hasn't changed much. I've tried a number of dim sum appetizers here and the Shanghai soup dumplings continue to be the best relative to the other options. Although, in comparison with other pork soup dumplings I've had at different establishments, this one falls to the bottom. The dough is too thick and vastly overpowers the under-seasoned filling. $13 for 5 pieces is also on the steep side. The peking duck was acceptable. It came with a pate you spread across the bao for flavor. There are only 3 baos that come with the order so expect disproportionate portions. I prefer my peking duck be wrapped thin pancakes or wraps, but unfortunately they don't offer that here. I much prefer the duck at Bamboo House or Jade at a much reasonable cost with more authentic flavors. The truffle fried rice was very underwhelming. Something that can easily be made at home. The only toppings it consisted of were egg and maybe 2 shavings of truffle. For a restaurant that encourages family style meals, the pork belly was really the only dish that was abundant. Unfortunately, it was doused in a sauce that didn't highlight the protein. The bird nest was probably the best thing that was ordered during this visit. The vegetables were seasoned nicely and the nest it was held in provided a satisfying crunch.

For dessert, we got the mango bomb and the fly me to the moon. I found the mango bomb a bit too tart the more bites I took, but fly me to the moon was finished off in a blink of an eye. Overall, if you're looking to spend a pretty penny, there are plenty of other options to choose from with beautiful ambiance and better bang for your buck. If you're looking for more authentic flavors, best to look elsewhere.","Food - Shanghai soup dumplings (best relative to other options, falls to the bottom compared to other pork soup dumplings), Peking duck (acceptable, disproportionate portions for baos), Truffle fried rice (underwhelming, easily made at home, lacked toppings), Pork belly (doused in sauce that didn't highlight protein), Bird nest (best, seasoned vegetables, satisfying crunch), Mango bomb (bit too tart), Fly me to the moon (finished off quickly)||Ambiance - Beautiful, modern and traditional mix||Price - high||Service - superb"
"I was a little skeptical when my friend suggested ""upscale"" dim sum in Austin. both because I prefer my dim sum with no frills and because I hadn't found many great Asian places in the city. Street parking might not be the easiest but there's a parking garage for the building that Qi is located in. We were able to quickly get seating at the bar, which provides the best view of the steamers, woks, stock pots and chefs in action.

Crab meat corn soup: substantial lumps of crab, warm, comforting soup. Great with some of the chili oil that you can ask for on the side
Asian fried chicken: tender and juicy, seemed to be roasted rather than deep fried. Sauce of palm sugar and lime is addictive.
Pan sear basil chicken dumpling: never had Thai holy basil in a dumpling before, but it works. Thin wrapper and just lightly crispy.
Szechuan peppercorn alligator: battered pieces of alligator with some toasted chilies, peppercorn, and scallion. Similar in texture to chicken and good flavor, but definitely more suitable for sharing family style.
Truffle egg fried rice - in my opinion, a bit on the drier side though it's typical to use day-old rice. Yolk is mixed with each grain of rice to give a golden hue, and the yolk and earthy truffle flavor makes for a really fragrant bite. I think the truffle shaving on top could have been a bit thinner and maybe some scallions to garnish would have ben nice
Tingling daisy: probably the most unique cocktail I've had. You're supposed to take a nibble of the peppercorn flower in between sips for a little numbing sensation.

Overall, definitely a spot worth trying out in Austin when you're looking to splurge a little. Cozy and dim atmosphere with great food, would definitely return!","Food - Crab meat corn soup (substantial lumps of crab, warm and comforting), Asian fried chicken (tender and juicy, addictive sauce), Pan sear basil chicken dumpling (thin wrapper, lightly crispy, unique flavor), Szechuan peppercorn alligator (good flavor, more suitable for sharing), Truffle egg fried rice (fragrant, slightly dry, earthy flavor), Tingling daisy cocktail (unique, numbing sensation)||Parking - Garage available||Ambiance - Cozy and dim||Service - Great||Price - Worth splurging"
"Qi Austin is located at the very bottom of what seems to be a corporate office and you can definitely tell that people come here for lunch. I would highly recommend making a reservation because it fills up pretty quickly and that is the first thing they ask when walking in.

The service was pretty good and I was attended to frequently and the servers make sure to take your plate once you finish.

I went during lunch and ordered the

-Shanghai Soup Dumplings - The soup dumplings were very savory especially with the vinegar they provide. It came in 5, and we devoured it almost instantly.
-Shrimp Hargow - The shrimp hargow also came in 5. The quality of ingredients used were extraordinary. Again, it was devoured pretty quickly.
-Lunch Sesame Chicken - The lunch size is relatively small and is the perfect size in my opinion. The outer crust was super crispy paired with the sweet sauce made the dish very good.
-Lunch Akaushi Beef - The sauce is a little bit on the sour side, which didnt sit too well with me. However, the beef and vegetables itself were cooked to perfection and was super savory. I give the beef a 4.9/5.

All in all, I highly recommend Qis. It is on the pricer side for dim sum and their dim sum menu is relatively small, however their lunch specials more than make up for it.","Food - Shanghai Soup Dumplings (very savory, devoured quickly), Shrimp Hargow (extraordinary quality, devoured quickly), Lunch Sesame Chicken (super crispy, very good), Lunch Akaushi Beef (sour sauce, cooked to perfection, savory beef and vegetables)||Location - Bottom of corporate office, busy during lunch||Service - Attentive, frequent||Price - slightly high"
"Need date night ideas...come to Qi Austin!  Our table ordered a multitude of items.  Honestly couldn't tell you the name of some of them, but everything I tried was absolutely delicious! My favorite was the Sugarcane Shrimp, Truffle Fried Rice & Dumplings. I also learned there is a certain way to eat a dumpling.  1st time eating a dumpling. Shame on me. But now I know the proper way and will be back for more. The Zha Jiang Noodle was my least favorite.  It wasn't bad, but I just like noodles that have more sauce. If you come with a larger group it's a fun spot to share a few plates. Although I will say between two people the Half Peking Duck & Zha Jiang Noodle is more than enough. I'll be back for date night!","Food - Sugarcane Shrimp (favorite), Truffle Fried Rice (favorite), Dumplings (absolutely delicious, favorite), Zha Jiang Noodle (Not bad, prefer noodles with more sauce)"
"Qi's is an upscale dim sum and Chinese cuisine restaurant. Not only is the decor beautiful, but the food and service was good as well.

The interior of Qi's is nicely decorated with a mix of modern and traditional.

The service was phenomenal! The servers consistently checked up on us throughout the time and were very attentive, and after being seated, they pass out intricate designed plates and small bowls.

I ordered the Shanghai soup dumplings, shrimp hargow, vegetable steamed dumplings, pan akaushi beef potstickers,  sesame chicken, and the salt and pepper tofu.

Dim Sum:
The Shanghai soup dumplings tasted delicious and creamy with just the right amount of soup and were my favorite.  The shrimp hargow was plump and had a huge shrimp. The pan akaushi came nicely decorated. The steamed vegetable dumplings were my least favorite. They tasted very strong of something earthy and bitter. I do not recommend getting them.

Other Food:
The sesame chicken was good but tasted more generic. The salt and pepper tofu were pretty good, but I wish the outside were more crispy.

Overall, the ambiance is nice, and the food is good with superb service.","Food - Shanghai soup dumplings (delicious and creamy), shrimp hargow (plump with huge shrimp), pan akaushi beef potstickers (nicely decorated), sesame chicken (good but generic), salt and pepper tofu (pretty good, could be crispier)||Ambiance - Beautiful mix of modern and traditional décor||Service - Phenomenal, attentive"
"Me and my boyfriend came here for Friday night for date night and we had an amazing time!! We got the Shanghai soup dumplings, the caviar Shumai, pork belly, bok choy with shiitake mushrooms, and the spicy sesame chicken. We liked everything we got but our favorites were the shumai and the pork belly bc of how flavorful and juicy/tender they were!! They are known for their Shanghai soup dumplings but they were kinda eh to me just bc they tasted kinda frozen. We were so stuffed at the end and it was fun sharing everything family style. For drinks we got the lycheetini, watermelon cooler, and some sake all of them were so delicious! We made a reservation so we were seated right away and the service was really quick!! Overall a really cute and yummy date night spot especially if you like to dress cute would definitely recommend!!","Food - Shanghai soup dumplings (eh, tasted frozen), caviar Shumai (flavorful), pork belly (flavorful, juicy, tender), bok choy with shiitake mushrooms (liked), spicy sesame chicken(liked)||Drinks - Lycheetini (delicious), watermelon cooler (delicious), sake (delicious)||Ambiance - Really cute spot for date night||Service - Quick, efficient"
"came here for dinner on a thursday evening. the service was pretty good, but the food & drinks are even better. ambiance is cool, modern, and not-overtly-trying-too-hard feels. i loved the lychee martini, prickly pear paloma, soup dumplings, potstickers, sesame balls, and the Chinese Fried Chicken - awooga AWOOGA !!!","Drinks - Lychee martini (loved), Prickly pear paloma (loved)||Food - Soup dumplings (loved), Potstickers (loved), Sesame balls (loved), Chinese fried chicken (loved)||Ambiance - Cool, modern, not-overtly-trying-too-hard"
"Amazing dim sum and great service! On the pricier side, but one of the best dim sum places I've been to all year.. Fresh ingredients, a dash of fusion, piping hot when it comes out, with more that I haven't tried yet.

Crab meat fish maw soup couplings - skin is on the thicker side, filling juicy and tender. Only complaint I have was that they didn't give me a soup spoon or extra bowls to eat this without spilling the juice.

Pork and shrimp sui mai - very fresh with good consistency.

Scallop caviar siu mai - amazingly good! 3 for $15 is a bit higher than the 5 for $12 normal siu mai, but flavor, texture (it was all mixed together, and not a normal siu mai with a scallop on top), juiciness exceeded my expectations. This siu mai was one of the best Ive had.

Scallion pancake curry dip - I like the concept and the strong onion flavor in the pancake, but I don't think the concept was executed very well. The pancake is on the smaller size and the curry is more liquid, so dipping it is very light, vs what you might get in a burmese paratha with coconut curry dip.

Crispy chicken turnover - They look like little mice, with the outsides having a mochi consistency and insides being on the salty savory side. Really well done and highly recommended!

Shrimp stuffed chinese eggplant - This was more of a shrimp on top of an eggplant.. Shrimp was very tender with good flavor. I liked the overall consistency of the dish, but would recommend giving it a min to cool down before starting.

Egg custard tart - very well executed with nice flavor, and extra flaky crust. It was more on the yellow side, and I personally would have preferred a little bit of a burn on the top.

The one dish I would not recommend is the stir fried potato glass noodle. For $19 its on the larger side, and its 100% carbs, so good value, but on the drier side and way too much to eat.","Food - Crab meat fish maw soup dumplings (thicker skin, juicy and tender filling), Pork and shrimp sui mai (very fresh, good consistency), Scallop caviar siu mai (amazingly good, exceeded expectations), Scallion pancake curry dip (concept liked, execution lacking), Crispy chicken turnover (well done, highly recommended), Shrimp stuffed Chinese eggplant (shrimp tender, good flavor), Egg custard tart (well executed, nice flavor, extra flaky crust), Stir fried potato glass noodle (on the drier side, too much to eat)||Service - Great||Price - high"
"Dinner in the city with my family...
We came for the dim sum...well no...I came for the dim sum and they came for the noodles.
I wasn't impressed with the food but the ambiance and service was impeccable. Idk...it's kinda hard judging Asian cuisine in the states when you're born and raised in Okinawa, so I don't want to be too picky.. but the main complaint was that all the noodle dishes we ordered was just too greasy. The food was fresh and had good flavors. cool place to catch up with friends for apps n drinks but no more big dinners here for us.

Baby bokchoy - 10
Crispy potstickers - 8
Scallop caviar siumai - 7
XiaoLongBao - 7
Crabsoup dumpling - 7
Shrimp dumpling - 7
Zha jiang noodles - 8","Food - Baby bokchoy (fresh, flavorful), Crispy potstickers (good), Scallop caviar siu mai (good), XiaoLongBao (good), Crabsoup dumpling (good), Shrimp dumpling (good), Zha jiang noodles (too greasy)||Service - Impeccable||Ambiance - Cool"
"I enjoyed some yummy food here!

Steam lobster dumplings- delicious, I'd get this again
Shrimp har gao - average
Basil Chicken dumplings - it was good
Chicken taro egg rolls --this was my favorite!
I didn't care for the passionfruit dessert at all.

I like the more elevated/upscale vibe though it didn't seem too busy on a weekend. The service was okay. Keep in mind, this isn't one of those places with the rolling cart (which I happen to love but that's okay).

Qi has great food and is a good option for grabbing dim sum.","Food - Steam lobster dumplings (delicious, would get again), Shrimp har gao (average), Basil Chicken dumplings (good), Chicken taro egg rolls (favorite), Passionfruit dessert (not good)||Ambiance - Elevated, upscale vibe||Service - Okay"
"For the price I was not wild about it.
We did sit outside which probably put a bigger damper on our evening because it was so freaking hot outside. Please sit inside lol. Service was okay.
We got the soup dumplings 10/10.
Veggie dumplings 3/10.
Lobster dumplings 7/10.
Beef potstickers 10/10.
Pickle platter 8/10.
Combo fried rice 6/10.

For dessert I got the mango bomb which was very pretty. Presentation was amazing. I wasn't too wild about it and my daughter got this berry dream. It was almost like a macaroon with lemon sorbet.

The inside and outside was very clean and trendy. The bathrooms were really nice. I personally wouldn't come back. However I can see this being a cute GNO.","Food - Soup dumplings (10/10), Veggie dumplings (3/10), Lobster dumplings (7/10), Beef potstickers (10/10), Pickle platter (8/10), Combo fried rice (6/10), Mango bomb (presentation amazing, not wild about it), Berry dream (almost like a macaroon with lemon sorbet)||Service - Okay||Ambiance - Clean, trendy"
